{
  "release_id": "rel:20261001-1",
  "created_at": "2026-10-01T09:00:00Z",
  "frozen_at": "2026-10-01T09:00:00Z",
  "members": {
    "raw_assets": [
      "raw:sha256:0123456789abcdef0123456789abcdef0123456789abcdef0123456789abcdef"
    ],
    "segments": [
      "seg:0123456789ab:p12-14:terms:seg-1.0"
    ],
    "terms_editions": [
      "ted:01BX5ZZKBKACTAV9WEVGEMMVRY"
    ],
    "terms_lineages": [],
    "clauses": [
      "clause:seg:0123456789ab:p12-14:terms:seg-1.0/art7#p12:docproc-text@1.0"
    ],
    "nodes": [],
    "assertions": [
      "a:01ARZ3NDEKTSV4RRFFQ69G5FAV"
    ],
    "conflicts": [],
    "gaps": [
      "gap:01J0000000000000000000000A"
    ],
    "premium_observations": [
      "premium:01H8XGJWBWBAQ4Z4RN3XPQ3BDY"
    ],
    "criteria_release_ref": "crel:20261001-1"
  },
  "rule_files": {
    "rules/fixture-rule-001.json": "fedcba9876543210fedcba9876543210fedcba9876543210fedcba9876543210"
  },
  "input_stage_edition": "case-0.2",
  "content_sha256": "0123456789abcdef0123456789abcdef0123456789abcdef0123456789abcdef",
  "onto_version": "onto-0.2",
  "vocabulary_version": "1.5.0",
  "label_dictionary_version": "labels-0.1",
  "schema_version": "0.1.0",
  "extractor_versions": [
    "docproc-text@1.0"
  ],
  "model_versions": [
    {
      "provider_family_label": "family-a",
      "model_ref_hash": "00ff00ff00ff00ff00ff00ff00ff00ff00ff00ff00ff00ff00ff00ff00ff00ff",
      "prompt_version": "p-1"
    }
  ],
  "engine_version": "0.1.0",
  "rule_schema_versions": [
    "rule-0.1"
  ],
  "capability_table_hash": "fedcba9876543210fedcba9876543210fedcba9876543210fedcba9876543210",
  "explain_template_hash": "00ff00ff00ff00ff00ff00ff00ff00ff00ff00ff00ff00ff00ff00ff00ff00ff",
  "constraint_report_id": "constraint-report-1"
}
